{
  "schema_version": 1,
  "contributor": "abm9111",
  "vigil_version": "0.5.0",
  "records": [
    {
      "schema_version": 1,
      "vigil_version": "0.4.0",
      "mode": "audit",
      "timestamp_bucket": "2026-Q3",
      "stack": [
        "python",
        "sqlite"
      ],
      "tree_state": "clean",
      "repo_size_bucket": "tiny",
      "duration_bucket": "5-10min",
      "tools": {
        "available": [
          "git",
          "ruff",
          "mypy",
          "bandit",
          "pip-audit",
          "gitleaks",
          "trufflehog",
          "detect-secrets",
          "trivy",
          "hadolint"
        ],
        "missing": [
          "sqlfluff",
          "semgrep",
          "eslint",
          "tsc"
        ]
      },
      "clusters": [
        {
          "prefix": "SEC",
          "verdict": "scored",
          "ceiling": 100,
          "critical": 0,
          "high": 0,
          "medium": 1,
          "low": 7,
          "info": 0
        },
        {
          "prefix": "CODE",
          "verdict": "scored",
          "ceiling": 100,
          "medium": 0,
          "low": 7
        },
        {
          "prefix": "DATA",
          "verdict": "scored",
          "ceiling": 85,
          "high": 1,
          "info": 1
        },
        {
          "prefix": "EGRESS",
          "verdict": "scored",
          "ceiling": 100,
          "info": 1
        },
        {
          "prefix": "AIML",
          "verdict": "scored",
          "ceiling": 85,
          "medium": 1
        },
        {
          "prefix": "COMP",
          "verdict": "scored",
          "ceiling": 85,
          "low": 1
        },
        {
          "prefix": "API",
          "verdict": "na",
          "na_trigger": "no-matching-files",
          "ceiling": null
        },
        {
          "prefix": "PERF",
          "verdict": "na",
          "na_trigger": "no-matching-files",
          "ceiling": null
        },
        {
          "prefix": "INFRA",
          "verdict": "na",
          "na_trigger": "no-matching-manifest",
          "ceiling": null
        },
        {
          "prefix": "FE",
          "verdict": "na",
          "na_trigger": "no-matching-files",
          "ceiling": null
        },
        {
          "prefix": "CHAIN",
          "verdict": "na",
          "na_trigger": "no-contract-files",
          "ceiling": null
        }
      ],
      "correlations": [
        {
          "pattern": "INTEGRITY_THEATER",
          "severity": "high",
          "primary": "DATA",
          "constituents": 2
        }
      ],
      "false_positives_withdrawn": 2,
      "verdict": "fail",
      "partial_score": 82,
      "capped_to": 79,
      "cap_reason": "high",
      "transmitted": false,
      "shared": "asked-accepted"
    },
    {
      "schema_version": 1,
      "vigil_version": "0.5.0",
      "mode": "audit",
      "timestamp_bucket": "2026-Q3",
      "stack": [
        "python",
        "node",
        "typescript",
        "react",
        "github-actions"
      ],
      "tree_state": "dirty",
      "repo_size_bucket": "small",
      "duration_bucket": "10-30min",
      "tools": {
        "available": [
          "git",
          "bandit",
          "semgrep",
          "gitleaks",
          "trufflehog",
          "detect-secrets",
          "pip-audit",
          "ruff",
          "mypy",
          "tsc",
          "trivy",
          "hadolint",
          "npm-audit"
        ],
        "missing": [
          "eslint"
        ]
      },
      "clusters": [
        {
          "prefix": "SEC",
          "verdict": "scored",
          "ceiling": 100,
          "critical": 0,
          "high": 2,
          "medium": 2,
          "low": 1,
          "info": 0
        },
        {
          "prefix": "CODE",
          "verdict": "scored",
          "ceiling": 85,
          "critical": 0,
          "high": 0,
          "medium": 2,
          "low": 2,
          "info": 0
        },
        {
          "prefix": "API",
          "verdict": "scored",
          "ceiling": 100,
          "critical": 0,
          "high": 0,
          "medium": 2,
          "low": 0,
          "info": 0
        },
        {
          "prefix": "DATA",
          "verdict": "scored",
          "ceiling": 100,
          "critical": 0,
          "high": 0,
          "medium": 1,
          "low": 0,
          "info": 0
        },
        {
          "prefix": "INFRA",
          "verdict": "scored",
          "ceiling": 100,
          "critical": 0,
          "high": 1,
          "medium": 1,
          "low": 0,
          "info": 0
        },
        {
          "prefix": "FE",
          "verdict": "scored",
          "ceiling": 100,
          "critical": 0,
          "high": 0,
          "medium": 1,
          "low": 0,
          "info": 0
        },
        {
          "prefix": "PERF",
          "verdict": "scored",
          "ceiling": 100,
          "critical": 0,
          "high": 0,
          "medium": 1,
          "low": 0,
          "info": 0
        },
        {
          "prefix": "COMP",
          "verdict": "scored",
          "ceiling": 100,
          "critical": 0,
          "high": 0,
          "medium": 3,
          "low": 1,
          "info": 0
        },
        {
          "prefix": "AIML",
          "verdict": "scored",
          "ceiling": 100,
          "critical": 0,
          "high": 0,
          "medium": 0,
          "low": 0,
          "info": 0
        },
        {
          "prefix": "EGRESS",
          "verdict": "scored",
          "ceiling": 100,
          "critical": 0,
          "high": 0,
          "medium": 0,
          "low": 1,
          "info": 0
        },
        {
          "prefix": "CHAIN",
          "verdict": "na",
          "na_trigger": "no-matching-files",
          "ceiling": null,
          "critical": 0,
          "high": 0,
          "medium": 0,
          "low": 0,
          "info": 0
        },
        {
          "prefix": "CORR",
          "verdict": "scored",
          "ceiling": 100,
          "critical": 0,
          "high": 1,
          "medium": 0,
          "low": 1,
          "info": 0
        }
      ],
      "correlations": [
        {
          "pattern": "DEPENDENCY_AND_REACHABILITY",
          "severity": "low",
          "primary": "SEC",
          "constituents": 2
        },
        {
          "pattern": "INTEGRITY_THEATER",
          "severity": "high",
          "primary": "INFRA",
          "constituents": 1
        }
      ],
      "false_positives_withdrawn": 11,
      "verdict": "fail",
      "partial_score": 88,
      "capped_to": 79,
      "cap_reason": "high",
      "transmitted": false,
      "shared": "asked-accepted"
    },
    {
      "schema_version": 1,
      "vigil_version": "0.5.0",
      "mode": "audit",
      "timestamp_bucket": "2026-Q3",
      "stack": [
        "python",
        "node",
        "typescript",
        "react",
        "github-actions"
      ],
      "tree_state": "clean",
      "repo_size_bucket": "small",
      "duration_bucket": "10-30min",
      "tools": {
        "available": [
          "git",
          "bandit",
          "semgrep",
          "gitleaks",
          "trufflehog",
          "detect-secrets",
          "pip-audit",
          "ruff",
          "mypy",
          "tsc",
          "trivy",
          "hadolint",
          "npm-audit"
        ],
        "missing": [
          "eslint"
        ]
      },
      "clusters": [
        {
          "prefix": "SEC",
          "verdict": "scored",
          "ceiling": 100,
          "critical": 0,
          "high": 2,
          "medium": 2,
          "low": 1,
          "info": 0
        },
        {
          "prefix": "CODE",
          "verdict": "scored",
          "ceiling": 85,
          "critical": 0,
          "high": 0,
          "medium": 2,
          "low": 2,
          "info": 0
        },
        {
          "prefix": "API",
          "verdict": "scored",
          "ceiling": 100,
          "critical": 0,
          "high": 0,
          "medium": 2,
          "low": 0,
          "info": 0
        },
        {
          "prefix": "DATA",
          "verdict": "scored",
          "ceiling": 100,
          "critical": 0,
          "high": 0,
          "medium": 1,
          "low": 0,
          "info": 0
        },
        {
          "prefix": "INFRA",
          "verdict": "scored",
          "ceiling": 100,
          "critical": 0,
          "high": 1,
          "medium": 1,
          "low": 0,
          "info": 0
        },
        {
          "prefix": "FE",
          "verdict": "scored",
          "ceiling": 100,
          "critical": 0,
          "high": 0,
          "medium": 1,
          "low": 0,
          "info": 0
        },
        {
          "prefix": "PERF",
          "verdict": "scored",
          "ceiling": 100,
          "critical": 0,
          "high": 0,
          "medium": 1,
          "low": 0,
          "info": 0
        },
        {
          "prefix": "COMP",
          "verdict": "scored",
          "ceiling": 100,
          "critical": 0,
          "high": 0,
          "medium": 3,
          "low": 1,
          "info": 0
        },
        {
          "prefix": "AIML",
          "verdict": "scored",
          "ceiling": 100,
          "critical": 0,
          "high": 0,
          "medium": 0,
          "low": 0,
          "info": 0
        },
        {
          "prefix": "EGRESS",
          "verdict": "scored",
          "ceiling": 100,
          "critical": 0,
          "high": 0,
          "medium": 0,
          "low": 1,
          "info": 0
        },
        {
          "prefix": "CHAIN",
          "verdict": "na",
          "na_trigger": "no-matching-files",
          "ceiling": null,
          "critical": 0,
          "high": 0,
          "medium": 0,
          "low": 0,
          "info": 0
        },
        {
          "prefix": "CORR",
          "verdict": "scored",
          "ceiling": 100,